{
  "$schema": "https://json-schema.org/draft/2020-12/schema",
  "title": "OCP System Status Dump Schema",
  "type": "object",
  "properties": {
    "nodeId": {
      "type": "string",
      "description": "Unique identifier for the node"
    },
    "nodeType": {
      "$ref": "#/$defs/systemAssemblyType",
      "description": "Type of node (e.g., AI Server, Ethernet Switch, Management Tray)"
    },
    "hostName": {
      "type": "string",
      "description": "Node hostname"
    },
    "vid": {
      "type": "string",
      "pattern": "^[0-9A-Fa-f]{4}$",
      "description": "PCIe Vendor ID"
    },
    "pid": {
      "type": "string",
      "pattern": "^[0-9A-Fa-f]{4}$",
      "description": "PCIe Product ID"
    },
    "healthy": {
          "type": "boolean"
        },
    "mode": { 
      "type": "string" 
    },
    "status": { 
      "type": "string" 
    },
    "lastError": { 
      "type": "string" 
    },
    "errorLog": {
      "type": "array",
      "items": { "type": "string" }
    },
    "lifecycle": { 
      "type": "string" 
    },
    "power": { 
      "$ref": "#/$defs/power" 
    },
    "temperature": {
      "$ref": "#/$defs/temperature"
    },
    "vendor": {
      "$ref": "#/$defs/vendor"
    },
    "physicalLocation": {
      "type": "object",
      "description": "Physical location of the node in the datacenter",
      "properties": {
        "rack": {
          "type": "string"
        },
        "row": {
          "type": "string"
        },
        "datacenter": {
          "type": "string"
        },
        "placement": {
          "type": "object",
          "properties": {
            "type": {
              "$ref": "#/$defs/physicalLocationType",
              "description": "Placement type"
            },
            "slot": {
              "type": "integer",
              "description": "Rack unit position if RackSlot"
            },
            "heightInU": {
              "type": "integer",
              "description": "Height in U if RackSlot"
            },
            "bayId": {
              "type": "string",
              "description": "Bay identifier if Bay"
            },
            "bayPosition": {
              "type": "string",
              "description": "Position within the bay"
            }
          },
          "required": [
            "type"
          ]
        }
      },
      "required": [
        "rack",
        "row",
        "datacenter",
        "placement"
      ]
    },
    "assemblies": {
      "type": "array",
      "description": "List of assemblies within the node (supports nested assemblies)",
      "items": {
        "$ref": "#/$defs/assembly"
      }
    }
  },
  "required": [
    "nodeId",
    "nodeType",
    "vid",
    "pid",
    "healthy",
    "mode",
    "status",
    "lifecycle",
    "assemblies"
  ],
  "$defs": {
    "power": {
      "type": "object",
      "required": ["power","voltage", "current"],
      "additionalProperties": false,
      "properties": {
        "power": {
          "type": "number" 
         },
        "powerUnit": {
          "type": "string",
          "enum" : [
            "Watt",
            "kiloWatt",
            "megaWatt"
          ],
           "default": "Watt"
         },
        "voltage": {
          "type": "number" 
         },
        "voltageUnit": {
          "type": "string",
          "enum" : [
            "Volt",
            "kiloVolt"
          ],
          "default": "Volt"
         },
        "current": {
          "type": "number" 
         },
        "currentUnit": {
          "type": "string",
          "enum" : [
            "Amps",
            "kiloAmps",
            "megaAmps"
          ],
          "default": "Amps"
         }
      }
    },
    "temperature": {
      "type": "object",
      "required": ["temperature"],
      "additionalProperties": false,
      "properties": {
        "temperature": {
          "type": "number"
         },
         "temperatureUnit": {
          "type": "string",
          "enum" : [
            "Degrees C",
            "Degrees F",
            "Kelvins"
          ],
           "default": "Degrees C"
         }
      }
    },
    "performance": {
      "type": "object",
      "description": "Performance metrics; keys vary by component type.",
      "additionalProperties": {
        "type": "string"
      },
      "properties": {
        "Packet Loss/Resend": {
          "type": "number" 
         },
        "Thermal Throttling": {
          "type": "number" 
         },
        "ECC": {
          "type": "number" 
         }
      }
    },
    "utilization": {
      "description": "Utilization may be a single percentage string or a map of resource utilizations.",
      "oneOf": [
        { "type": "string" },
        {
          "type": "object",
          "additionalProperties": {
            "type": "number"
          },
          "properties": {
            "accelerator": {
              "type": "number" 
              },
            "acceleration": {
               "type": "number" 
             },
            "ram": {
              "type": "number" 
             }
          }
        }
      ]
    },
    "vendor": {
      "description": "Vendor defined details when present; otherwise null.",
      "oneOf": [
        { "type": "null" },
        {
          "type": "object",
          "additionalProperties": {
            "type": "string"
          },
          "properties": {
            "organization": { "type": "string" }
          }
        }
      ]
    },
    "assembly": {
      "type": "object",
      "properties": {
        "assemblyName": {
          "type": "string"
        },
        "assemblyId": {
          "type": "string"
        },
        "manufacturerSerialNumber": {
          "type": "string",
          "description": "Manufacturer's serial number for the assembly"
        },
        "vid": {
          "type": "string",
          "pattern": "^[0-9A-Fa-f]{4}$",
          "description": "PCIe Vendor ID"
        },
        "pid": {
          "type": "string",
          "pattern": "^[0-9A-Fa-f]{4}$",
          "description": "PCIe Product ID"
        },
        "healthy": {
          "type": "boolean"
        },
        "mode": { 
          "type": "string" 
        },
        "status": { 
          "type": "string" 
        },
        "lastError": { 
          "type": "string" 
        },
        "errorLog": {
          "type": "array",
          "items": { "type": "string" }
        },
        "lifecycle": { 
          "type": "string" 
        },
        "power": { 
          "$ref": "#/$defs/power" 
        },
        "temperature": {
          "$ref": "#/$defs/temperature"
        },
        "vendor": {
          "$ref": "#/$defs/vendor"
        },
        "physicalLocation": {
          "type": "object",
          "description": "Physical slot or bay where this assembly is installed",
          "properties": {
            "slot": {
              "type": "string",
              "description": "Physical slot identifier (e.g., PCIe slot, OCP slot)"
            },
            "position": {
              "type": "string",
              "description": "Position within the node or assembly"
            }
          }
        },
        "components": {
          "type": "array",
          "items": {
            "$ref": "#/$defs/component"
          }
        },
        "subAssemblies": {
          "type": "array",
          "items": {
            "$ref": "#/$defs/assembly"
          }
        }
      },
      "required": [
        "assemblyName",
        "assemblyId",
        "vid",
        "pid",
        "healthy"
      ]
    },
    "component": {
      "type": "object",
      "properties": {
        "componentClass": {
          "$ref": "#/$defs/componentClass",
          "description": "Industry-aligned component class."
        },
        "componentId": {
          "type": "string"
        },
        "manufacturerSerialNumber": {
          "type": "string",
          "description": "Manufacturer's serial number for the component"
        },
        "vid": {
          "type": "string",
          "pattern": "^[0-9A-Fa-f]{4}$",
          "description": "PCIe Vendor ID"
        },
        "pid": {
          "type": "string",
          "pattern": "^[0-9A-Fa-f]{4}$",
          "description": "PCIe Product ID"
        },
        "physicalLocation": {
          "type": "object",
          "description": "Physical slot or bay where this component is installed",
          "properties": {
            "slot": {
              "type": "string",
              "description": "Physical slot identifier (e.g., PCIe slot, DIMM slot)"
            },
            "position": {
              "type": "string",
              "description": "Position within the node or assembly"
            }
          }
        },
        "healthy": {
          "type": "boolean"
        },
        "mode": { "type": "string" },
        "status": {
          "type": "string",
          "examples": ["Ok", "Crash", "ERD"]
        },
        "lastError": {
          "type": "string",
          "examples": ["NULL", "1D10T", "501", "T"]
        },
        "errorLog": {
          "type": "array",
          "items": {
            "type": "string"
          }
        },
        "lifecycle": {
          "type": "string",
          "examples": ["production", "quarantine", "development"]
        },
        "power": { 
          "$ref": "#/$defs/power" 
        },
        "temperature": {
          "$ref": "#/$defs/temperature"
        },
        "vendor": {
          "$ref": "#/$defs/vendor"
        },
        "utilization": {
          "$ref": "#/$defs/utilization"
        },
        "clockSpeed": {
          "type": "number"
        },
        "clockSpeedUnit": {
          "type": "string",
          "examples": ["GHz", "MHz"] 
        },
        "interface": {
          "type": "string",
          "examples": ["USB", "PCI-E"]
        },
        "communication": {
          "type": "string",
          "examples": ["PLDM", "Redfish"]
        },
        "dataRate": {
          "type": "number" 
        },
        "dataRateValue": {
          "type": "string",
          "examples": ["MT/s"]
        },
        "performance": {
          "$ref": "#/$defs/performance"  
        },
        "latency": {
          "type": "number"
        },
        "latencyUnit": {
          "type": "string",
          "examples": ["Seconds", "Milliseconds"]
        },
        "errorRate": {
          "type": "number" 
         },
        "errorUnit": {
          "type": "string",
          "examples": ["errors per second"]
        },
        "subComponents": {
          "type": "array",
          "items": {
            "$ref": "#/$defs/component"
          }
        }
      },
      "required": [
        "componentId",
        "vid",
        "pid",
        "healthy",
        "status",
        "lastError"
      ]
    },
    "physicalLocationType": {
      "type": "string",
      "description": "Industry-aligned physical installation location type.",
      "enum": [
        "rackUnit",
        "bay",
        "slot",
        "socket",
        "drawer",
        "shelf",
        "tray",
        "cage",
        "zone"
      ]
    },
    "componentClass": {
      "type": "string",
      "description": "Industry-aligned component class (inventory category).",
      "enum": [
        "processor",
        "memory",
        "networkInterface",
        "storageDevice",
        "accelerator",
        "powerSupply",
        "fan",
        "thermalSensor",
        "voltageRegulator",
        "clockGenerator",
        "retimer",
        "bridge",
        "switchASIC",
        "controller",
        "bios",
        "firmware",
        "bmc",
        "managementController",
        "securityModule",
        "fpga",
        "cpld"
      ]
    },
    "systemAssemblyType": {
      "type": "string",
      "description": "Industry-aligned top-level assembly type (system/chassis class).",
      "enum": [
        "server",
        "blade",
        "computeNode",
        "ethernetSwitch",
        "networkAppliance",
        "storageSystem",
        "jbod",
        "nvmeShelf",
        "acceleratorSystem",
        "gpuServer",
        "managementController",
        "rackManager",
        "powerDistributionUnit",
        "powerShelf",
        "batteryBackupUnit",
        "coolingDistributionUnit",
        "coolingManifold",
        "liquidCoolingSystem",
        "chassis",
        "enclosure"
      ]
    }
  }
}